{
  "priority": 10,
  "active": true,
  "rtbBlockId": "R-A-2849102-2",
  "endDate": "2026-12-31",
  "startDate": "2026-01-01",
  "imageUrl": "https://images.unsplash.com/photo-1558494949-ef010cbdcc31?w=600&auto=format&fit=crop&q=80",
  "title": "Cloud NVMe VPS Servers for Developers - 50% Off",
  "id": "vps-ultra-promo-2026",
  "slot": "sidebar",
  "targetUrl": "https://partner-cloud.example.com/deploy?utm_source=hallizar_blog&utm_medium=banner&utm_campaign=sidebar_spring2026&utm_content=vps_promo"
}
