{
  "priority": 5,
  "active": true,
  "rtbBlockId": "R-A-2849102-3",
  "endDate": "2026-11-30",
  "startDate": "2026-02-01",
  "imageUrl": "https://images.unsplash.com/photo-1544197150-b99a580bb7a8?w=700&auto=format&fit=crop&q=80",
  "title": "Global Edge CDN & Serverless Storage for Astro Sites",
  "id": "fast-edge-cdn-promo",
  "slot": "in-article",
  "targetUrl": "https://fastcdn.example.com/signup?utm_source=hallizar_blog&utm_medium=banner&utm_campaign=in_article_contextual&utm_content=cdn_storage"
}
